,,question,content,category
1217,1236,можно перевести сотрудника на основную штатку с совместительства,"Перевод работника с изменением группы с внешнего совместителя на основного невозможен. Вам необходимо оформить заявку по теме «Увольнение по собственному желанию», после ее выполнения создать заявку «Прием на работу».",прием на работу
1218,1237,как перевести сотрудника с работы по совместительству на основную?,"Перевод работника с изменением группы с внешнего совместителя на основного невозможен. Вам необходимо оформить заявку по теме «Увольнение по собственному желанию», после ее выполнения создать заявку «Прием на работу».",прием на работу
1219,1238,При приеме иностранного гражданина требуется нотариально заверенный перевод паспорта?,"При приеме иностранного гражданина требуется перевод паспорта. Сотрудникам, осуществляющим прием, важно внести правильно каждую букву ФИО, места рождения и органа выдавшего документ, т.к. эти данные направляются в извещении для МВД. Если сотрудники допустят ошибку, это чревато сложностями как для компании, так и для самого кандидата. Инструкция и шаблоны доступны по ссылке https://company-x5.ru/cms/zayavkaskillaz",прием на работу
1220,1239,прием на работу,"Для приема необходимо выбрать ставку администратора-стажера, директора-стажера, заместителя-стажера.",прием на работу
1221,1240,принять на работу офис,"ог. развитие или планирование территории, для заведения заявки по процессу 5401 - Изменение организационной структуры и штатного расписания.",прием на работу
1222,1241,"Работодателю пришло извещение о пособии по уходу за ребенком, что делать?","В течение 5 рабочих дней работодатель предоставит ответ на извещение, после чего пособие будет выплачено.",прием на работу
1223,1242,"Сотрудник не вышел на работу, как отменить прием?","В случае, когда сотрудник не приступил к работе, т.е. не отработал ни одного дня, создается заявка на сотрудника в блоке Отмена\аннулирование мероприятия. Инструкция и шаблон находятся по ссылке https://company-x5.ru/cms/5206",прием на работу
1224,1243,"Что делать, если иностранный гражданин отказывается предоставить нотариально заверенный перевод паспорта при приеме?","Иностранный гражданин при оформлении РВП, ВНЖ обязательно предоставляет нотариально заверенный перевод паспорта, т.е. он у него уже есть, дополнительно заказывать и оплачивать его не нужно. При приеме достаточно копии. Сотрудникам, осуществляющим прием, важно внести правильно каждую букву ФИО, места рождения и органа выдавшего документ, т.к. эти данные направляются в извещении для МВД. Если сотрудники допустят ошибку, это чревато сложностями как для компании, так и для самого кандидата. Инструкция и шаблоны доступны по ссылке https://company-x5.ru/cms/zayavkaskillaz",прием на работу
1225,1244,Сотруднику в ЛК не приходит ссылка на заполнение анкеты СБ,Анкета СБ приходит при первичном трудоустройстве,СБ
1226,1245,где забрать мою справку,"В заявке на заказ справки Вы указываете, где хотите ее получить. Получение справки возможно в региональном офисе или в магазине. Обратите внимание, что отправка справки в магазин обычно производится в течение 10-ти рабочих дней.",справка
1227,1246,Как я смогу получить готовую справку?,"В заявке на заказ справки Вы указываете, где хотите ее получить. Получение справки возможно в региональном офисе или в магазине. Обратите внимание, что отправка справки в магазин обычно производится в течение 10-ти рабочих дней.",справка
1228,1247,"я заказала справку, как я ее получу?","В заявке на заказ справки Вы указываете, где хотите ее получить. Получение справки возможно в региональном офисе или в магазине. Обратите внимание, что отправка справки в магазин обычно производится в течение 10-ти рабочих дней.",справка
1229,1248,куда придет заказанная справка,"В заявке на заказ справки Вы указываете, где хотите ее получить. Получение справки возможно в региональном офисе или в магазине. Обратите внимание, что отправка справки в магазин обычно производится в течение 10-ти рабочих дней.",справка
1230,1249,где мне получить готовую справку?,"В заявке на заказ справки Вы указываете, где хотите ее получить. Получение справки возможно в региональном офисе или в магазине. Обратите внимание, что отправка справки в магазин обычно производится в течение 10-ти рабочих дней.",справка
1231,1250,Как заказать справку?,"Для заказа справки создайте, пожалуйста, заявку в разделе ""Заявки"" по теме ""Справки и копии документов"".",справка
1232,1251,нужна справка,"Для заказа справки создайте, пожалуйста, заявку в разделе ""Заявки"" по теме ""Справки и копии документов"".",справка
1233,1252,заказать справку,"Для заказа справки создайте, пожалуйста, заявку в разделе ""Заявки"" по теме ""Справки и копии документов"".",справка
1234,1253,"Прием сотрудника 60 лет, в военкомате отказываются выдавать справку. Какой документ необходимо предоставить на прием?","В соответствии со ст. 65 ТК РФ работник должен представить, а работодатель обязан потребовать документы, необходимые для заключения трудового договора. Военнообязанные и лица, подлежащие призыву на военную службу, при заключении трудового договора должны предъявить документы воинского учета. В силу Положения о воинском учете, утвержденного Постановлением Правительства РФ от 25 декабря 1998 г. N 1541, основными документами воинского учета являются: для граждан, пребывающих в запасе, - военный билет (временное удостоверение, выданное взамен военного билета). Так как мужчины офицерских званий являются военнообязанными до 65-70 лет, считать кандидата невоеннообязанным, опираясь на данные возраста, нет возможности. Кандидат обязан предоставить военный билет с отметкой о снятии с учета или справку из военного комиссариата с соответствующей информацией. Инструкция и шаблоны доступны по ссылке https://company-x5.ru/cms/zayavkaskillaz",справка
1235,1254,"Нет возможности создать заявку на сотрудника по табельному учету, прошу решить проблему","Если в ""команде"" нет подчиненных сотрудников просьба обратиться в поддержку для корректировки",табель
1236,1255,НЕТ ИНФОРМАЦИИ О МОЕЙ КОМАНДЕ,"Если в ""команде"" нет подчиненных сотрудников просьба обратиться в поддержку для корректировки",табель
1237,1256,не могу заказать справку сотруднику,"Если в ""команде"" нет подчиненных сотрудников просьба обратиться в поддержку для корректировки",табель
1238,1257,не отображается вкладка моя команда,"Если в ""команде"" нет подчиненных сотрудников просьба обратиться в поддержку для корректировки",табель
1239,1258,"В разделе команда в личном кабинете исчезли вкладки сотрудники, должности и т.д. Не пада.т заявки на прием","Если в ""команде"" нет подчиненных сотрудников просьба обратиться в поддержку для корректировки",табель
1240,1259,Нет сотрудника В ЛК,"Если в ""команде"" нет подчиненных сотрудников просьба обратиться в поддержку для корректировки",табель
1241,1260,"После перевода на должность дм партнер 2ой категории пропала команда, не могу создать увольнение,прием.","Если в ""команде"" нет подчиненных сотрудников просьба обратиться в поддержку для корректировки",табель
1242,1261,не отображается моя команда. нет возможности создавать заявки,"Если в ""команде"" нет подчиненных сотрудников просьба обратиться в поддержку для корректировки",табель
1243,1262,в личном кабинете скорректировать команду,"Если в ""команде"" нет подчиненных сотрудников просьба обратиться в поддержку для корректировки",табель
1244,1263,нет возможности создать заявки на сотрудника,"Если в ""команде"" нет подчиненных сотрудников просьба обратиться в поддержку для корректировки",табель
1245,1264,привязка команды,"Если в ""команде"" нет подчиненных сотрудников просьба обратиться в поддержку для корректировки",табель
1246,1265,открыть в личном кабинете директору свою команду для создание заявок на сотрудников магазина,"Если в ""команде"" нет подчиненных сотрудников просьба обратиться в поддержку для корректировки",табель
1247,1266,Нет моей команды в ЛК. С уважением ДМ,"Если в ""команде"" нет подчиненных сотрудников просьба обратиться в поддержку для корректировки",табель
1248,1267,"не отображается моя команда, не возможно сделать заявку на сотрудников. Через поиск не находит.","Если в ""команде"" нет подчиненных сотрудников просьба обратиться в поддержку для корректировки",табель
1249,1268,В лк не отображаются сотрудники.,"Если в ""команде"" нет подчиненных сотрудников просьба обратиться в поддержку для корректировки",табель
1250,1269,"в вкладке задачи пропали документы для архива, в кладке команда нет сотрудников","Если в ""команде"" нет подчиненных сотрудников просьба обратиться в поддержку для корректировки",табель
1251,1270,Не могу сделать заявку на сотрудника,"Если в ""команде"" нет подчиненных сотрудников просьба обратиться в поддержку для корректировки",табель
1252,1271,Нету команды в личном кабинете.,"Если в ""команде"" нет подчиненных сотрудников просьба обратиться в поддержку для корректировки",табель
1253,1272,привязать сотрудников магазина,"Если в ""команде"" нет подчиненных сотрудников просьба обратиться в поддержку для корректировки",табель
1254,1273,Не вижу в ЛК команду,"Если в ""команде"" нет подчиненных сотрудников просьба обратиться в поддержку для корректировки",табель
1255,1274,"Я директор Алусова Румия Камзаевна, в личном кабинете не отражается моя команда и нет возможности создать заявки на сотрудников","Если в ""команде"" нет подчиненных сотрудников просьба обратиться в поддержку для корректировки",табель
1256,1275,В личном кабинете директора нет моей команды,"Если в ""команде"" нет подчиненных сотрудников просьба обратиться в поддержку для корректировки",табель
1257,1276,"в личном кабинете исчезли все задвчи и заявки, так же исчезла вкладка ""моя команда"" с сотрудниками","Если в ""команде"" нет подчиненных сотрудников просьба обратиться в поддержку для корректировки",табель
1258,1277,В личном кабинете отсутвует список подчиненных,"Если в ""команде"" нет подчиненных сотрудников просьба обратиться в поддержку для корректировки",табель
1259,1278,В личном кабинете нет сотрудников. Не могу на них создавать заявки,"Если в ""команде"" нет подчиненных сотрудников просьба обратиться в поддержку для корректировки",табель
1260,1279,"не работает личный кабинет, не могу создать заявку на сотрудника ""учет рабочего времени, табель""","Если в ""команде"" нет подчиненных сотрудников просьба обратиться в поддержку для корректировки",табель
1261,1280,"не работает личный кабинет, нет моей команды. нет возможности уволить сотрудника и провести изменения характера работы","Если в ""команде"" нет подчиненных сотрудников просьба обратиться в поддержку для корректировки",табель
1262,1281,"У меня проблема с личным кабинетом , не отображается команда.","Если в ""команде"" нет подчиненных сотрудников просьба обратиться в поддержку для корректировки",табель
1263,1282,"оформлена совместителем ДМ на магазине, в личном кабинете не отображается моя команда,нет возможности создать заявку на оформление сотрудников","Если в ""команде"" нет подчиненных сотрудников просьба обратиться в поддержку для корректировки",табель
1264,1283,"Здравствуйте, я директор магазина, прозошел сбой на портале не могу создать заявку на перевод.Не могу найти команду","Если в ""команде"" нет подчиненных сотрудников просьба обратиться в поддержку для корректировки",табель
1265,1284,в личном кабинете не прогружена Моя команда. Личный кабинет настроен как на адм. Нет доступа ДМ,"Если в ""команде"" нет подчиненных сотрудников просьба обратиться в поддержку для корректировки",табель
1266,1285,"Не могу сделать заявку на сотрудника, нет привязки","Если в ""команде"" нет подчиненных сотрудников просьба обратиться в поддержку для корректировки",табель
1267,1286,не отображается моя команда,"Если в ""команде"" нет подчиненных сотрудников просьба обратиться в поддержку для корректировки",табель
1268,1287,не отображается данные команды в личном кабинете,"Если в ""команде"" нет подчиненных сотрудников просьба обратиться в поддержку для корректировки",табель
1269,1288,У директоров магазинов нет возможности создавать заявки на сотрудников,"Если в ""команде"" нет подчиненных сотрудников просьба обратиться в поддержку для корректировки",табель
1270,1289,не привязана команда,"Если в ""команде"" нет подчиненных сотрудников просьба обратиться в поддержку для корректировки",табель
1271,1290,Доступ дм,"Если в ""команде"" нет подчиненных сотрудников просьба обратиться в поддержку для корректировки",табель
1272,1291,"Нет вкладки ""Команда"", нет сотрудников?","Если в ""команде"" нет подчиненных сотрудников просьба обратиться в поддержку для корректировки",табель
1273,1292,НЕ отображаются сотрудники в личном кабинете,"Если в ""команде"" нет подчиненных сотрудников просьба обратиться в поддержку для корректировки",табель
1274,1293,"В личном кабинете,в разделе Моя команда отсутствуют подтемы. которые были раньше. Например список сотрудников.","Если в ""команде"" нет подчиненных сотрудников просьба обратиться в поддержку для корректировки",табель
1275,1294,У меня пропала команда из личного кабинета. НЕ могу составить заявки на сотрудников.,"Если в ""команде"" нет подчиненных сотрудников просьба обратиться в поддержку для корректировки",табель
1276,1295,не все функции,"Если в ""команде"" нет подчиненных сотрудников просьба обратиться в поддержку для корректировки",табель
1277,1296,"Сотрудник числиться в табеле как продавец-кассир, но в ЛК ДМ в штате не отображается при создании заявки","Если в ""команде"" нет подчиненных сотрудников просьба обратиться в поддержку для корректировки",табель
1278,1297,исчезли вкладки в личном кабинете,"Если в ""команде"" нет подчиненных сотрудников просьба обратиться в поддержку для корректировки",табель
1279,1298,пропал доступ к заявкам в личном кабинете директора,"Если в ""команде"" нет подчиненных сотрудников просьба обратиться в поддержку для корректировки",табель
1280,1299,"нет в личном кабинете-моя команда сотрудников,и в заявках тоже ничего нет-не могу сделать заявку на декретницу","Если в ""команде"" нет подчиненных сотрудников просьба обратиться в поддержку для корректировки",табель
1281,1300,Не могу создать заявку на сотрудника,"Если в ""команде"" нет подчиненных сотрудников просьба обратиться в поддержку для корректировки",табель
1282,1301,переведена на должность директора в личный кабинет до сих пор не поступают заявки на сотрудников,"Если в ""команде"" нет подчиненных сотрудников просьба обратиться в поддержку для корректировки",табель
1283,1302,"я ДМ и не могу создать заявку на увольнение сотрудника в своем личном кабинете, по причине того, что вкладка Команда у меня пустая","Если в ""команде"" нет подчиненных сотрудников просьба обратиться в поддержку для корректировки",табель
