,,question,content,category
443,444,восстановить пароль,"При проблемах со входом в личный кабинет, прежде чем создавать заявку в поддержку, убедитесь, что заходите в ЛК на сайте https://company-x5.ru, указываете актуальные и верные логин и пароль. Если Вам неизвестен логин, обратитесь к руководителю (ДМ), он сможет посмотреть Ваш логин и сбросить пароль в веб-табеле. Для самостоятельного сброса пароля позвоните с вашего мобильного телефона на +7 (XXX) XXX XX XX, наберите добавочный номер 10100, нажмите * и подтвердите сброс пароля, нажав #. Обновленный пароль отправляется по SMS.",ЛК
444,445,нет логина и пароля у сотрудника,"При проблемах со входом в личный кабинет, прежде чем создавать заявку в поддержку, убедитесь, что заходите в ЛК на сайте https://company-x5.ru, указываете актуальные и верные логин и пароль. Если Вам неизвестен логин, обратитесь к руководителю (ДМ), он сможет посмотреть Ваш логин и сбросить пароль в веб-табеле. Для самостоятельного сброса пароля позвоните с вашего мобильного телефона на +7 (XXX) XXX XX XX, наберите добавочный номер 10100, нажмите * и подтвердите сброс пароля, нажав #. Обновленный пароль отправляется по SMS.",ЛК
445,446,Не могу зайти в личный кабинет. Выдает ошибку. На горячую линию звонила так же меня нет в базе.,"При проблемах со входом в личный кабинет, прежде чем создавать заявку в поддержку, убедитесь, что заходите в ЛК на сайте https://company-x5.ru, указываете актуальные и верные логин и пароль. Если Вам неизвестен логин, обратитесь к руководителю (ДМ), он сможет посмотреть Ваш логин и сбросить пароль в веб-табеле. Для самостоятельного сброса пароля позвоните с вашего мобильного телефона на +7 (XXX) XXX XX XX, наберите добавочный номер 10100, нажмите * и подтвердите сброс пароля, нажав #. Обновленный пароль отправляется по SMS.",ЛК
446,447,не могу зайти в личный уабинет,"При проблемах со входом в личный кабинет, прежде чем создавать заявку в поддержку, убедитесь, что заходите в ЛК на сайте https://company-x5.ru, указываете актуальные и верные логин и пароль. Если Вам неизвестен логин, обратитесь к руководителю (ДМ), он сможет посмотреть Ваш логин и сбросить пароль в веб-табеле. Для самостоятельного сброса пароля позвоните с вашего мобильного телефона на +7 (XXX) XXX XX XX, наберите добавочный номер 10100, нажмите * и подтвердите сброс пароля, нажав #. Обновленный пароль отправляется по SMS.",ЛК
447,448,"Не могу зайти в личный кабинет, пишет что не верно введен логин или пароль, хотя все верно","При проблемах со входом в личный кабинет, прежде чем создавать заявку в поддержку, убедитесь, что заходите в ЛК на сайте https://company-x5.ru, указываете актуальные и верные логин и пароль. Если Вам неизвестен логин, обратитесь к руководителю (ДМ), он сможет посмотреть Ваш логин и сбросить пароль в веб-табеле. Для самостоятельного сброса пароля позвоните с вашего мобильного телефона на +7 (XXX) XXX XX XX, наберите добавочный номер 10100, нажмите * и подтвердите сброс пароля, нажав #. Обновленный пароль отправляется по SMS.",ЛК
448,449,не могу зайти в лк,"При проблемах со входом в личный кабинет, прежде чем создавать заявку в поддержку, убедитесь, что заходите в ЛК на сайте https://company-x5.ru, указываете актуальные и верные логин и пароль. Если Вам неизвестен логин, обратитесь к руководителю (ДМ), он сможет посмотреть Ваш логин и сбросить пароль в веб-табеле. Для самостоятельного сброса пароля позвоните с вашего мобильного телефона на +7 (XXX) XXX XX XX, наберите добавочный номер 10100, нажмите * и подтвердите сброс пароля, нажав #. Обновленный пароль отправляется по SMS.",ЛК
449,450,не зайти в лк.нет доступа,"При проблемах со входом в личный кабинет, прежде чем создавать заявку в поддержку, убедитесь, что заходите в ЛК на сайте https://company-x5.ru, указываете актуальные и верные логин и пароль. Если Вам неизвестен логин, обратитесь к руководителю (ДМ), он сможет посмотреть Ваш логин и сбросить пароль в веб-табеле. Для самостоятельного сброса пароля позвоните с вашего мобильного телефона на +7 (XXX) XXX XX XX, наберите добавочный номер 10100, нажмите * и подтвердите сброс пароля, нажав #. Обновленный пароль отправляется по SMS.",ЛК
450,451,нет возможности зайти в личный кабинет,"При проблемах со входом в личный кабинет, прежде чем создавать заявку в поддержку, убедитесь, что заходите в ЛК на сайте https://company-x5.ru, указываете актуальные и верные логин и пароль. Если Вам неизвестен логин, обратитесь к руководителю (ДМ), он сможет посмотреть Ваш логин и сбросить пароль в веб-табеле. Для самостоятельного сброса пароля позвоните с вашего мобильного телефона на +7 (XXX) XXX XX XX, наберите добавочный номер 10100, нажмите * и подтвердите сброс пароля, нажав #. Обновленный пароль отправляется по SMS.",ЛК
451,452,Нужен логин и пароль для https://company-x5.ru,"При проблемах со входом в личный кабинет, прежде чем создавать заявку в поддержку, убедитесь, что заходите в ЛК на сайте https://company-x5.ru, указываете актуальные и верные логин и пароль. Если Вам неизвестен логин, обратитесь к руководителю (ДМ), он сможет посмотреть Ваш логин и сбросить пароль в веб-табеле. Для самостоятельного сброса пароля позвоните с вашего мобильного телефона на +7 (XXX) XXX XX XX, наберите добавочный номер 10100, нажмите * и подтвердите сброс пароля, нажав #. Обновленный пароль отправляется по SMS.",ЛК
452,453,нужен логин и пароль от личного кабинета,"При проблемах со входом в личный кабинет, прежде чем создавать заявку в поддержку, убедитесь, что заходите в ЛК на сайте https://company-x5.ru, указываете актуальные и верные логин и пароль. Если Вам неизвестен логин, обратитесь к руководителю (ДМ), он сможет посмотреть Ваш логин и сбросить пароль в веб-табеле. Для самостоятельного сброса пароля позвоните с вашего мобильного телефона на +7 (XXX) XXX XX XX, наберите добавочный номер 10100, нажмите * и подтвердите сброс пароля, нажав #. Обновленный пароль отправляется по SMS.",ЛК
453,454,Сотрудник не может войти в ЛК,"При проблемах со входом в личный кабинет, прежде чем создавать заявку в поддержку, убедитесь, что заходите в ЛК на сайте https://company-x5.ru, указываете актуальные и верные логин и пароль. Если Вам неизвестен логин, обратитесь к руководителю (ДМ), он сможет посмотреть Ваш логин и сбросить пароль в веб-табеле. Для самостоятельного сброса пароля позвоните с вашего мобильного телефона на +7 (XXX) XXX XX XX, наберите добавочный номер 10100, нажмите * и подтвердите сброс пароля, нажав #. Обновленный пароль отправляется по SMS.",ЛК
454,455,Смена пароля,"При проблемах со входом в личный кабинет, прежде чем создавать заявку в поддержку, убедитесь, что заходите в ЛК на сайте https://company-x5.ru, указываете актуальные и верные логин и пароль. Если Вам неизвестен логин, обратитесь к руководителю (ДМ), он сможет посмотреть Ваш логин и сбросить пароль в веб-табеле. Для самостоятельного сброса пароля позвоните с вашего мобильного телефона на +7 (XXX) XXX XX XX, наберите добавочный номер 10100, нажмите * и подтвердите сброс пароля, нажав #. Обновленный пароль отправляется по SMS.",ЛК
455,456,"ДМП магазина после проведения перевода ДМП на категорию от 02.05.2024 не может зайти в ЛК, АСУЗ. прошу проверить привязку по сотруднику","При проблемах со входом в личный кабинет, прежде чем создавать заявку в поддержку, убедитесь, что заходите в ЛК на сайте https://company-x5.ru, указываете актуальные и верные логин и пароль. Если Вам неизвестен логин, обратитесь к руководителю (ДМ), он сможет посмотреть Ваш логин и сбросить пароль в веб-табеле. Для самостоятельного сброса пароля позвоните с вашего мобильного телефона на +7 (XXX) XXX XX XX, наберите добавочный номер 10100, нажмите * и подтвердите сброс пароля, нажав #. Обновленный пароль отправляется по SMS.",ЛК
456,457,продавец не может зайти в личный кабинет,"При проблемах со входом в личный кабинет, прежде чем создавать заявку в поддержку, убедитесь, что заходите в ЛК на сайте https://company-x5.ru, указываете актуальные и верные логин и пароль. Если Вам неизвестен логин, обратитесь к руководителю (ДМ), он сможет посмотреть Ваш логин и сбросить пароль в веб-табеле. Для самостоятельного сброса пароля позвоните с вашего мобильного телефона на +7 (XXX) XXX XX XX, наберите добавочный номер 10100, нажмите * и подтвердите сброс пароля, нажав #. Обновленный пароль отправляется по SMS.",ЛК
457,458,не входит в личный кабинет,"При проблемах со входом в личный кабинет, прежде чем создавать заявку в поддержку, убедитесь, что заходите в ЛК на сайте https://company-x5.ru, указываете актуальные и верные логин и пароль. Если Вам неизвестен логин, обратитесь к руководителю (ДМ), он сможет посмотреть Ваш логин и сбросить пароль в веб-табеле. Для самостоятельного сброса пароля позвоните с вашего мобильного телефона на +7 (XXX) XXX XX XX, наберите добавочный номер 10100, нажмите * и подтвердите сброс пароля, нажав #. Обновленный пароль отправляется по SMS.",ЛК
458,459,сотрудник не получил пароль и логин от личного кабинета,"При проблемах со входом в личный кабинет, прежде чем создавать заявку в поддержку, убедитесь, что заходите в ЛК на сайте https://company-x5.ru, указываете актуальные и верные логин и пароль. Если Вам неизвестен логин, обратитесь к руководителю (ДМ), он сможет посмотреть Ваш логин и сбросить пароль в веб-табеле. Для самостоятельного сброса пароля позвоните с вашего мобильного телефона на +7 (XXX) XXX XX XX, наберите добавочный номер 10100, нажмите * и подтвердите сброс пароля, нажав #. Обновленный пароль отправляется по SMS.",ЛК
459,461,Не могу заходить под своим паролям в личный кабинет как с компа так и с мобильного приложения,"При проблемах со входом в личный кабинет, прежде чем создавать заявку в поддержку, убедитесь, что заходите в ЛК на сайте https://company-x5.ru, указываете актуальные и верные логин и пароль. Если Вам неизвестен логин, обратитесь к руководителю (ДМ), он сможет посмотреть Ваш логин и сбросить пароль в веб-табеле. Для самостоятельного сброса пароля позвоните с вашего мобильного телефона на +7 (XXX) XXX XX XX, наберите добавочный номер 10100, нажмите * и подтвердите сброс пароля, нажав #. Обновленный пароль отправляется по SMS.",ЛК
460,462,нет логина и пароля в лк,"При проблемах со входом в личный кабинет, прежде чем создавать заявку в поддержку, убедитесь, что заходите в ЛК на сайте https://company-x5.ru, указываете актуальные и верные логин и пароль. Если Вам неизвестен логин, обратитесь к руководителю (ДМ), он сможет посмотреть Ваш логин и сбросить пароль в веб-табеле. Для самостоятельного сброса пароля позвоните с вашего мобильного телефона на +7 (XXX) XXX XX XX, наберите добавочный номер 10100, нажмите * и подтвердите сброс пароля, нажав #. Обновленный пароль отправляется по SMS.",ЛК
461,464,Не удается зайти в ЛК сотрудника,"При проблемах со входом в личный кабинет, прежде чем создавать заявку в поддержку, убедитесь, что заходите в ЛК на сайте https://company-x5.ru, указываете актуальные и верные логин и пароль. Если Вам неизвестен логин, обратитесь к руководителю (ДМ), он сможет посмотреть Ваш логин и сбросить пароль в веб-табеле. Для самостоятельного сброса пароля позвоните с вашего мобильного телефона на +7 (XXX) XXX XX XX, наберите добавочный номер 10100, нажмите * и подтвердите сброс пароля, нажав #. Обновленный пароль отправляется по SMS.",ЛК
462,465,новый сотрудник через рабочий компьютер не может зайти в личный кабинет.,"При проблемах со входом в личный кабинет, прежде чем создавать заявку в поддержку, убедитесь, что заходите в ЛК на сайте https://company-x5.ru, указываете актуальные и верные логин и пароль. Если Вам неизвестен логин, обратитесь к руководителю (ДМ), он сможет посмотреть Ваш логин и сбросить пароль в веб-табеле. Для самостоятельного сброса пароля позвоните с вашего мобильного телефона на +7 (XXX) XXX XX XX, наберите добавочный номер 10100, нажмите * и подтвердите сброс пароля, нажав #. Обновленный пароль отправляется по SMS.",ЛК
463,466,Сотрудник через телефон и ПК на работе не может зайти в ЛК,"При проблемах со входом в личный кабинет, прежде чем создавать заявку в поддержку, убедитесь, что заходите в ЛК на сайте https://company-x5.ru, указываете актуальные и верные логин и пароль. Если Вам неизвестен логин, обратитесь к руководителю (ДМ), он сможет посмотреть Ваш логин и сбросить пароль в веб-табеле. Для самостоятельного сброса пароля позвоните с вашего мобильного телефона на +7 (XXX) XXX XX XX, наберите добавочный номер 10100, нажмите * и подтвердите сброс пароля, нажав #. Обновленный пароль отправляется по SMS.",ЛК
464,467,не можем войти в лк,"При проблемах со входом в личный кабинет, прежде чем создавать заявку в поддержку, убедитесь, что заходите в ЛК на сайте https://company-x5.ru, указываете актуальные и верные логин и пароль. Если Вам неизвестен логин, обратитесь к руководителю (ДМ), он сможет посмотреть Ваш логин и сбросить пароль в веб-табеле. Для самостоятельного сброса пароля позвоните с вашего мобильного телефона на +7 (XXX) XXX XX XX, наберите добавочный номер 10100, нажмите * и подтвердите сброс пароля, нажав #. Обновленный пароль отправляется по SMS.",ЛК
465,468,нет пароля,"При проблемах со входом в личный кабинет, прежде чем создавать заявку в поддержку, убедитесь, что заходите в ЛК на сайте https://company-x5.ru, указываете актуальные и верные логин и пароль. Если Вам неизвестен логин, обратитесь к руководителю (ДМ), он сможет посмотреть Ваш логин и сбросить пароль в веб-табеле. Для самостоятельного сброса пароля позвоните с вашего мобильного телефона на +7 (XXX) XXX XX XX, наберите добавочный номер 10100, нажмите * и подтвердите сброс пароля, нажав #. Обновленный пароль отправляется по SMS.",ЛК
466,469,Нет доступа,"При проблемах со входом в личный кабинет, прежде чем создавать заявку в поддержку, убедитесь, что заходите в ЛК на сайте https://company-x5.ru, указываете актуальные и верные логин и пароль. Если Вам неизвестен логин, обратитесь к руководителю (ДМ), он сможет посмотреть Ваш логин и сбросить пароль в веб-табеле. Для самостоятельного сброса пароля позвоните с вашего мобильного телефона на +7 (XXX) XXX XX XX, наберите добавочный номер 10100, нажмите * и подтвердите сброс пароля, нажав #. Обновленный пароль отправляется по SMS.",ЛК
467,470,Нет возможности войти в личный кабинет сотрудника,"При проблемах со входом в личный кабинет, прежде чем создавать заявку в поддержку, убедитесь, что заходите в ЛК на сайте https://company-x5.ru, указываете актуальные и верные логин и пароль. Если Вам неизвестен логин, обратитесь к руководителю (ДМ), он сможет посмотреть Ваш логин и сбросить пароль в веб-табеле. Для самостоятельного сброса пароля позвоните с вашего мобильного телефона на +7 (XXX) XXX XX XX, наберите добавочный номер 10100, нажмите * и подтвердите сброс пароля, нажав #. Обновленный пароль отправляется по SMS.",ЛК
