,,question,content,category
731,745,Не отображается количество дней отпуска в личном кабинете (оставались дни за прошлые года),"Лимиты в личном кабинете отображаются на основании данных в кадровой системе. В процессе планирования, программа считает дни исходя из имеющихся лимитов и может предоставить дни отпуска авансом. На календарный год программа предоставляет лимит 28 дней. Период, за который накапливаются лимиты в количестве 28 дней, у каждого сотрудника индивидуальный и считается со дня приема в Компанию. За каждый последующий отработанный месяц предоставляется 2.33 дня отпуска. Специалистам HR следует проверить данные в 2001ИТ и в 2006ИТ, а именно сколько дней было запланировано и использовано в текущем году, есть ли неистраченные лимиты, есть ли продленный лимит на будущее. Проверить количество запланированных дней и доступных остатков. Посмотреть расчет отпускных дней отпуска на отчетную дату или на конец года можно через транзакцию ZHRPA036. Так же по существующему алгоритму при планировании отпусков в личном кабинете установлено правило - нельзя планировать более половины всех накопленных дней отпуска в первое полугодие до конца июня. У сотрудника прописано в личном кабинете, что нельзя планировать более 15 дней в первое полугодие.",отгул
732,746,Не отображается остаток доступного отпуска на будующий год,"Лимиты в личном кабинете отображаются на основании данных в кадровой системе. В процессе планирования, программа считает дни исходя из имеющихся лимитов и может предоставить дни отпуска авансом. На календарный год программа предоставляет лимит 28 дней. Период, за который накапливаются лимиты в количестве 28 дней, у каждого сотрудника индивидуальный и считается со дня приема в Компанию. За каждый последующий отработанный месяц предоставляется 2.33 дня отпуска. Специалистам HR следует проверить данные в 2001ИТ и в 2006ИТ, а именно сколько дней было запланировано и использовано в текущем году, есть ли неистраченные лимиты, есть ли продленный лимит на будущее. Проверить количество запланированных дней и доступных остатков. Посмотреть расчет отпускных дней отпуска на отчетную дату или на конец года можно через транзакцию ZHRPA036. Так же по существующему алгоритму при планировании отпусков в личном кабинете установлено правило - нельзя планировать более половины всех накопленных дней отпуска в первое полугодие до конца июня. У сотрудника прописано в личном кабинете, что нельзя планировать более 15 дней в первое полугодие.",отгул
733,747,"Не могу воспользоваться отпуском по заявлению , так как не высвечиваются доступные дни отпуска","Лимиты в личном кабинете отображаются на основании данных в кадровой системе. В процессе планирования, программа считает дни исходя из имеющихся лимитов и может предоставить дни отпуска авансом. На календарный год программа предоставляет лимит 28 дней. Период, за который накапливаются лимиты в количестве 28 дней, у каждого сотрудника индивидуальный и считается со дня приема в Компанию. За каждый последующий отработанный месяц предоставляется 2.33 дня отпуска. Специалистам HR следует проверить данные в 2001ИТ и в 2006ИТ, а именно сколько дней было запланировано и использовано в текущем году, есть ли неистраченные лимиты, есть ли продленный лимит на будущее. Проверить количество запланированных дней и доступных остатков. Посмотреть расчет отпускных дней отпуска на отчетную дату или на конец года можно через транзакцию ZHRPA036. Так же по существующему алгоритму при планировании отпусков в личном кабинете установлено правило - нельзя планировать более половины всех накопленных дней отпуска в первое полугодие до конца июня. У сотрудника прописано в личном кабинете, что нельзя планировать более 15 дней в первое полугодие.",отгул
734,748,Почему доступно для планирования не 28 дней?,"Лимиты в личном кабинете отображаются на основании данных в кадровой системе. В процессе планирования, программа считает дни исходя из имеющихся лимитов и может предоставить дни отпуска авансом. На календарный год программа предоставляет лимит 28 дней. Период, за который накапливаются лимиты в количестве 28 дней, у каждого сотрудника индивидуальный и считается со дня приема в Компанию. За каждый последующий отработанный месяц предоставляется 2.33 дня отпуска. Специалистам HR следует проверить данные в 2001ИТ и в 2006ИТ, а именно сколько дней было запланировано и использовано в текущем году, есть ли неистраченные лимиты, есть ли продленный лимит на будущее. Проверить количество запланированных дней и доступных остатков. Посмотреть расчет отпускных дней отпуска на отчетную дату или на конец года можно через транзакцию ZHRPA036. Так же по существующему алгоритму при планировании отпусков в личном кабинете установлено правило - нельзя планировать более половины всех накопленных дней отпуска в первое полугодие до конца июня. У сотрудника прописано в личном кабинете, что нельзя планировать более 15 дней в первое полугодие.",отгул
735,749,"В системе не назначен руководитель, как в этом случае запланировать отпуск?","Лимиты в личном кабинете отображаются на основании данных в кадровой системе. В процессе планирования, программа считает дни исходя из имеющихся лимитов и может предоставить дни отпуска авансом. На календарный год программа предоставляет лимит 28 дней. Период, за который накапливаются лимиты в количестве 28 дней, у каждого сотрудника индивидуальный и считается со дня приема в Компанию. За каждый последующий отработанный месяц предоставляется 2.33 дня отпуска. Специалистам HR следует проверить данные в 2001ИТ и в 2006ИТ, а именно сколько дней было запланировано и использовано в текущем году, есть ли неистраченные лимиты, есть ли продленный лимит на будущее. Проверить количество запланированных дней и доступных остатков. Посмотреть расчет отпускных дней отпуска на отчетную дату или на конец года можно через транзакцию ZHRPA036. Так же по существующему алгоритму при планировании отпусков в личном кабинете установлено правило - нельзя планировать более половины всех накопленных дней отпуска в первое полугодие до конца июня. У сотрудника прописано в личном кабинете, что нельзя планировать более 15 дней в первое полугодие.",отгул
736,750,Для планирования отпуска доступно только 28 дней. При этом в этом году имеется остаток дней. Просьба перенести остаток этого года и сделать его доступным для планирования на следующий год,"Лимиты в личном кабинете отображаются на основании данных в кадровой системе. В процессе планирования, программа считает дни исходя из имеющихся лимитов и может предоставить дни отпуска авансом. На календарный год программа предоставляет лимит 28 дней. Период, за который накапливаются лимиты в количестве 28 дней, у каждого сотрудника индивидуальный и считается со дня приема в Компанию. За каждый последующий отработанный месяц предоставляется 2.33 дня отпуска. Специалистам HR следует проверить данные в 2001ИТ и в 2006ИТ, а именно сколько дней было запланировано и использовано в текущем году, есть ли неистраченные лимиты, есть ли продленный лимит на будущее. Проверить количество запланированных дней и доступных остатков. Посмотреть расчет отпускных дней отпуска на отчетную дату или на конец года можно через транзакцию ZHRPA036. Так же по существующему алгоритму при планировании отпусков в личном кабинете установлено правило - нельзя планировать более половины всех накопленных дней отпуска в первое полугодие до конца июня. У сотрудника прописано в личном кабинете, что нельзя планировать более 15 дней в первое полугодие.",отгул
737,751,Сотруднику система дает запланировать только несколько дней из 28 возможных,"Лимиты в личном кабинете отображаются на основании данных в кадровой системе. В процессе планирования, программа считает дни исходя из имеющихся лимитов и может предоставить дни отпуска авансом. На календарный год программа предоставляет лимит 28 дней. Период, за который накапливаются лимиты в количестве 28 дней, у каждого сотрудника индивидуальный и считается со дня приема в Компанию. За каждый последующий отработанный месяц предоставляется 2.33 дня отпуска. Специалистам HR следует проверить данные в 2001ИТ и в 2006ИТ, а именно сколько дней было запланировано и использовано в текущем году, есть ли неистраченные лимиты, есть ли продленный лимит на будущее. Проверить количество запланированных дней и доступных остатков. Посмотреть расчет отпускных дней отпуска на отчетную дату или на конец года можно через транзакцию ZHRPA036. Так же по существующему алгоритму при планировании отпусков в личном кабинете установлено правило - нельзя планировать более половины всех накопленных дней отпуска в первое полугодие до конца июня. У сотрудника прописано в личном кабинете, что нельзя планировать более 15 дней в первое полугодие.",отгул
738,752,"Просьба уточнить, корректно ли отображается количество дней доступных к планированию?","Лимиты в личном кабинете отображаются на основании данных в кадровой системе. В процессе планирования, программа считает дни исходя из имеющихся лимитов и может предоставить дни отпуска авансом. На календарный год программа предоставляет лимит 28 дней. Период, за который накапливаются лимиты в количестве 28 дней, у каждого сотрудника индивидуальный и считается со дня приема в Компанию. За каждый последующий отработанный месяц предоставляется 2.33 дня отпуска. Специалистам HR следует проверить данные в 2001ИТ и в 2006ИТ, а именно сколько дней было запланировано и использовано в текущем году, есть ли неистраченные лимиты, есть ли продленный лимит на будущее. Проверить количество запланированных дней и доступных остатков. Посмотреть расчет отпускных дней отпуска на отчетную дату или на конец года можно через транзакцию ZHRPA036. Так же по существующему алгоритму при планировании отпусков в личном кабинете установлено правило - нельзя планировать более половины всех накопленных дней отпуска в первое полугодие до конца июня. У сотрудника прописано в личном кабинете, что нельзя планировать более 15 дней в первое полугодие.",отгул
739,753,У сотрудника не перенеслись не отгулянные дни для планирования в следующем году,"Лимиты в личном кабинете отображаются на основании данных в кадровой системе. В процессе планирования, программа считает дни исходя из имеющихся лимитов и может предоставить дни отпуска авансом. На календарный год программа предоставляет лимит 28 дней. Период, за который накапливаются лимиты в количестве 28 дней, у каждого сотрудника индивидуальный и считается со дня приема в Компанию. За каждый последующий отработанный месяц предоставляется 2.33 дня отпуска. Специалистам HR следует проверить данные в 2001ИТ и в 2006ИТ, а именно сколько дней было запланировано и использовано в текущем году, есть ли неистраченные лимиты, есть ли продленный лимит на будущее. Проверить количество запланированных дней и доступных остатков. Посмотреть расчет отпускных дней отпуска на отчетную дату или на конец года можно через транзакцию ZHRPA036. Так же по существующему алгоритму при планировании отпусков в личном кабинете установлено правило - нельзя планировать более половины всех накопленных дней отпуска в первое полугодие до конца июня. У сотрудника прописано в личном кабинете, что нельзя планировать более 15 дней в первое полугодие.",отгул
740,754,"Не могу внести график отпусков на следующий год, поля не активны","Лимиты в личном кабинете отображаются на основании данных в кадровой системе. В процессе планирования, программа считает дни исходя из имеющихся лимитов и может предоставить дни отпуска авансом. На календарный год программа предоставляет лимит 28 дней. Период, за который накапливаются лимиты в количестве 28 дней, у каждого сотрудника индивидуальный и считается со дня приема в Компанию. За каждый последующий отработанный месяц предоставляется 2.33 дня отпуска. Специалистам HR следует проверить данные в 2001ИТ и в 2006ИТ, а именно сколько дней было запланировано и использовано в текущем году, есть ли неистраченные лимиты, есть ли продленный лимит на будущее. Проверить количество запланированных дней и доступных остатков. Посмотреть расчет отпускных дней отпуска на отчетную дату или на конец года можно через транзакцию ZHRPA036. Так же по существующему алгоритму при планировании отпусков в личном кабинете установлено правило - нельзя планировать более половины всех накопленных дней отпуска в первое полугодие до конца июня. У сотрудника прописано в личном кабинете, что нельзя планировать более 15 дней в первое полугодие.",отгул
741,755,Просьба проверить почему участились жалобы со стороны сотрудников что не могут запланировать отпуск,"Лимиты в личном кабинете отображаются на основании данных в кадровой системе. В процессе планирования, программа считает дни исходя из имеющихся лимитов и может предоставить дни отпуска авансом. На календарный год программа предоставляет лимит 28 дней. Период, за который накапливаются лимиты в количестве 28 дней, у каждого сотрудника индивидуальный и считается со дня приема в Компанию. За каждый последующий отработанный месяц предоставляется 2.33 дня отпуска. Специалистам HR следует проверить данные в 2001ИТ и в 2006ИТ, а именно сколько дней было запланировано и использовано в текущем году, есть ли неистраченные лимиты, есть ли продленный лимит на будущее. Проверить количество запланированных дней и доступных остатков. Посмотреть расчет отпускных дней отпуска на отчетную дату или на конец года можно через транзакцию ZHRPA036. Так же по существующему алгоритму при планировании отпусков в личном кабинете установлено правило - нельзя планировать более половины всех накопленных дней отпуска в первое полугодие до конца июня. У сотрудника прописано в личном кабинете, что нельзя планировать более 15 дней в первое полугодие.",отгул
