,,question,content,category
0,0,"Я сменил автомобить, на учет еще не поставил, могу ли я заправляться по топливной карте?","Для внесения данных по личному автомобилю обратитесь, пожалуйста, к своему руководителю для создания заявки по теме ""Изменение режима характера работы"", подтема ""Установка РХР и топливной карты"". В комментариях опишите ситуацию и приложите ПТС, СТС, страховой полис и водительское удостоверение.",автомобиль
1,1,Не отображается автомобиль в личном кабинете.,"Для внесения данных по личному автомобилю обратитесь, пожалуйста, к своему руководителю для создания заявки по теме ""Изменение режима характера работы"", подтема ""Установка РХР и топливной карты"". В комментариях опишите ситуацию и приложите ПТС, СТС, страховой полис и водительское удостоверение.",автомобиль
2,2,добавить автомобиль,"Для внесения данных по личному автомобилю обратитесь, пожалуйста, к своему руководителю для создания заявки по теме ""Изменение режима характера работы"", подтема ""Установка РХР и топливной карты"". В комментариях опишите ситуацию и приложите ПТС, СТС, страховой полис и водительское удостоверение.",автомобиль
3,3,хочу внести данные об автомобиле,"Для внесения данных по личному автомобилю обратитесь, пожалуйста, к своему руководителю для создания заявки по теме ""Изменение режима характера работы"", подтема ""Установка РХР и топливной карты"". В комментариях опишите ситуацию и приложите ПТС, СТС, страховой полис и водительское удостоверение.",автомобиль
4,4,Как внести данные об автомобиле?,"Для внесения данных по личному автомобилю обратитесь, пожалуйста, к своему руководителю для создания заявки по теме ""Изменение режима характера работы"", подтема ""Установка РХР и топливной карты"". В комментариях опишите ситуацию и приложите ПТС, СТС, страховой полис и водительское удостоверение.",автомобиль
5,5,мне нужно внести данные об автомобиле,"Для внесения данных по личному автомобилю обратитесь, пожалуйста, к своему руководителю для создания заявки по теме ""Изменение режима характера работы"", подтема ""Установка РХР и топливной карты"". В комментариях опишите ситуацию и приложите ПТС, СТС, страховой полис и водительское удостоверение.",автомобиль
6,6,внести машину,"Для внесения данных по личному автомобилю обратитесь, пожалуйста, к своему руководителю для создания заявки по теме ""Изменение режима характера работы"", подтема ""Установка РХР и топливной карты"". В комментариях опишите ситуацию и приложите ПТС, СТС, страховой полис и водительское удостоверение.",автомобиль
7,7,"При смене автомобиля, который используется в служебных целях, как изменить марку и госномер авто в личном кабинете?","Для внесения данных по личному автомобилю обратитесь, пожалуйста, к своему руководителю для создания заявки по теме ""Изменение режима характера работы"", подтема ""Установка РХР и топливной карты"". В комментариях опишите ситуацию и приложите ПТС, СТС, страховой полис и водительское удостоверение.",автомобиль
8,8,"Будет ли оплачен больничный, если он открыт в другой стране?",Сотруднику следует обратиться в мед. организацию (по месту прописки) с данными документами для выдачи больничного листа российского образца. Оплата больничного листа возможна только на основании листа нетрудоспособности российского образца.,БиР
9,9,как оформить больничный по беременности и родам,"Пожалуйста, обратитесь к непосредственному руководителю, чтобы он создал заявку в Личном кабинете https://company-x5.ru или приложении ""Моя работа"" в разделе ""Декрет"", ""Администрирование отпуска БИР"".",БиР
10,10,что делать после получения больничного по беременности и родам,"Пожалуйста, обратитесь к непосредственному руководителю, чтобы он создал заявку в Личном кабинете https://company-x5.ru или приложении ""Моя работа"" в разделе ""Декрет"", ""Администрирование отпуска БИР"".",БиР
11,11,как оформить бир?,"Пожалуйста, обратитесь к непосредственному руководителю, чтобы он создал заявку в Личном кабинете https://company-x5.ru или приложении ""Моя работа"" в разделе ""Декрет"", ""Администрирование отпуска БИР"".",БиР
12,12,Как оформить больничный по беременности и родам?,"Сотруднику следует обратиться к непосредственному руководителю, чтобы он создал заявку в Личном кабинете https://company-x5.ru или приложении ""Моя работа"" в разделе ""Декрет"", ""Администрирование отпуска БИР"".",БиР
13,13,как оформить моей сотруднице декретный отпуск?,"Обратитесь к HRBP для создания заявки ""Администрирование БиР""",БиР
14,14,"сотрудница уходит в декрет, как мне провести ей декретный отпуск","Обратитесь к HRBP для создания заявки ""Администрирование БиР""",БиР
15,15,Как оформить пособие по рождению ребенка?,"Если ребенок зарегистрирован в ЗАГС 11.10.2023 или после 11.10.2023, и получателем пособия является мама ребенка, создавать заявку не нужно, необходимые данные работодателю будет направлять Социальный фонд России. Если ребенок зарегистрирован в ЗАГС до 11.10.2023 или получателем пособия является отец ребенка (независимо от даты регистрации), требуется создать заявку для передачи сведений в Социальный фонд России в Личном кабинете https://company-x5.ru или приложении ""Моя работа"" в разделе ""Декрет"", тема ""Выплата единовременного пособия по рождению ребенка"".",БиР
16,16,"Родила ребенка, как оформить пособие?","Если ребенок зарегистрирован в ЗАГС 11.10.2023 или после 11.10.2023, и получателем пособия является мама ребенка, создавать заявку не нужно, необходимые данные работодателю будет направлять Социальный фонд России. Если ребенок зарегистрирован в ЗАГС до 11.10.2023 или получателем пособия является отец ребенка (независимо от даты регистрации), требуется создать заявку для передачи сведений в Социальный фонд России в Личном кабинете https://company-x5.ru или приложении ""Моя работа"" в разделе ""Декрет"", тема ""Выплата единовременного пособия по рождению ребенка"".",БиР
17,17,хочу оформить единовременную выплату,"Если ребенок зарегистрирован в ЗАГС 11.10.2023 или после 11.10.2023, и получателем пособия является мама ребенка, создавать заявку не нужно, необходимые данные работодателю будет направлять Социальный фонд России. Если ребенок зарегистрирован в ЗАГС до 11.10.2023 или получателем пособия является отец ребенка (независимо от даты регистрации), требуется создать заявку для передачи сведений в Социальный фонд России в Личном кабинете https://company-x5.ru или приложении ""Моя работа"" в разделе ""Декрет"", тема ""Выплата единовременного пособия по рождению ребенка"".",БиР
18,18,Какие документы нужно подать на отпуск по уходу за ребенком?,"Сотруднику необходимо перейти по ссылке в Базу знаний Личного кабинета https://company-x5.ru/cms/1091, открыть инструкцию по процессу 1091 - Администрирование отпуска по уходу за ребенком.",БиР
19,19,Какие документы нужно предоставить для оформления пособия по беременности и родам,"Сотруднику следует написать заявление о предоставлении отпуска по беременности и родам и передать его непосредственному руководителю, он оформит соответствующее мероприятие.",БиР
20,20,Когда будет произведена выплата пособия по рождению ребенка?,Выплата единовременного пособия при рождении производится в течение 10 рабочих дней. С дополнительными вопросами сотрудник может обратиться в СФР по номеру 8 (800) 100-00-01,БиР
21,21,Сроки выплаты единовременного пособия при рождении ребенка,Выплата единовременного пособия при рождении производится в течение 10 рабочих дней. С дополнительными вопросами сотрудник может обратиться в СФР по номеру 8 (800) 100-00-01,БиР
22,22,"Когда отпуск по БИР закончился, нужно ли писать заявление?","Если сотрудник хочет уйти в отпуск по уходу за ребенком, ему следует написать заявление о предоставлении отпуска по уходу за ребенком и передать его непосредственному руководителю, он оформит соответствующее мероприятие.",БиР
23,23,Могу ли я получить пособие по беременности и родам по каждому месту работы,"Если Вы работаете в нескольких местах, то можете оформить пособие по беременности и родам на каждом месте работы. При расчетах будет учитываться средний заработок у каждого работодателя в течение 2 лет.",БиР
24,24,Возможно ли получить пособие по беременности и родам по каждому месту работы?,"Если Вы работаете в нескольких местах, то можете оформить пособие по беременности и родам на каждом месте работы. При расчетах будет учитываться средний заработок у каждого работодателя в течение 2 лет.",БиР
25,25,могу я получать пособие сразу в нескольких организациях?,"Если Вы работаете в нескольких местах, то можете оформить пособие по беременности и родам на каждом месте работы. При расчетах будет учитываться средний заработок у каждого работодателя в течение 2 лет.",БиР
26,26,Можно ли получать пособие по рождению ребенка сразу в нескольких организациях?,"Если Вы работаете в нескольких местах, то можете оформить пособие по беременности и родам на каждом месте работы. При расчетах будет учитываться средний заработок у каждого работодателя в течение 2 лет.",БиР
27,27,Могу я продолжить работать в отпуске по уходу за ребенком с сохранением пособия?,Сотрудник может досрочно выйти из отпуска по уходу за ребенком с сохранением пособия,БиР
28,28,Могу я продолжить работать в период больничного по беременности и родам и получать пособие,"Вы можете продолжить работу во время больничного по беременности и родам, при этом Вам будет выплачиваться заработная плата. Пособие по беременности и родам будет рассчитано с фактической даты ухода в отпуск по беременности и родам (соответственно, будет оплачено меньшее кол-во дней БИРа).",БиР
29,29,"Можно ли изменить период больничного по беременности и родам, если в ЭЛН указаны другие периоды","Вы можете продолжить работу во время больничного по беременности и родам, при этом Вам будет выплачиваться заработная плата. Пособие по беременности и родам будет рассчитано с фактической даты ухода в отпуск по беременности и родам (соответственно, будет оплачено меньшее кол-во дней БИРа).",БиР
30,30,Могут ли оба родителя получить единовременное пособие при рождении ребенка,"Право на единовременное пособие при рождении ребенка имеет один из родителей или лицо, официально его заменяющее.",БиР
31,31,Можем ли мы с мужем одновременно получать единовременное пособие при рождении,"Право на единовременное пособие при рождении ребенка имеет один из родителей или лицо, официально его заменяющее.",БиР
32,32,Могут ли оба родителя получить единовременное пособие при рождении ребенка?,"Право на единовременное пособие при рождении ребенка имеет один из родителей или лицо, официально его заменяющее.",БиР
33,33,"Можно ли изменить период больничного по беременности и родам, если в ЭЛН указаны другие периоды?","Сотрудник может продолжить работу во время больничного по беременности и родам, при этом ему будет выплачиваться заработная плата. Пособие по беременности и родам будет рассчитано с фактической даты ухода в отпуск по беременности и родам (соответственно, будет оплачено меньшее кол-во дней БИРа).",БиР
34,34,Могу я продолжить работать в период больничного по беременности и родам и получать пособие?,"Сотрудник может продолжить работу во время больничного по беременности и родам, при этом ему будет выплачиваться заработная плата. Пособие по беременности и родам будет рассчитано с фактической даты ухода в отпуск по беременности и родам (соответственно, будет оплачено меньшее кол-во дней БИРа).",БиР
35,35,нужно провести отпуск беременной,"Для оформления ежегодного отпуска вне графика сотрудник обращается к Бизнес - партнеру по персоналу для создания заявки в Личном кабинете по теме ""Отпуск вне графика (для HR)"", к заявке прикладывается справка о беременности. Заявления на отпуск принимаются за 6 дней до даты его начала.",БиР
36,36,как оформить отпуск по беременности,"Для оформления ежегодного отпуска вне графика сотрудник обращается к Бизнес - партнеру по персоналу для создания заявки в Личном кабинете по теме ""Отпуск вне графика (для HR)"", к заявке прикладывается справка о беременности. Заявления на отпуск принимаются за 6 дней до даты его начала.",БиР
37,37,как сделать отпуск беременной,"Для оформления ежегодного отпуска вне графика сотрудник обращается к Бизнес - партнеру по персоналу для создания заявки в Личном кабинете по теме ""Отпуск вне графика (для HR)"", к заявке прикладывается справка о беременности. Заявления на отпуск принимаются за 6 дней до даты его начала.",БиР
38,38,Нужно провести отпуск беременной сотруднице,"Для оформления ежегодного отпуска вне графика сотрудник обращается к Бизнес - партнеру по персоналу для создания заявки в Личном кабинете по теме ""Отпуск вне графика (для HR)"", к заявке прикладывается справка о беременности. Заявления на отпуск принимаются за 6 дней до даты его начала.",БиР
39,39,"оформила выплату на пособие при рождении ребенка, а оно не пришло","С данным вопросом сотруднику необходимо обратиться в СФР по номеру телефона 8 (800) 100-00-01. Если требуется сделать перерасчет в связи с заменой лет по заявлению, сотрудник должен создать заявку в Личном кабинете по теме ""Больничный"", ""Перерасчет пособий"".",БиР
40,40,Не устраивает расчет отпуска по уходу за ребенком,"С данным вопросом сотруднику необходимо обратиться в СФР по номеру телефона 8 (800) 100-00-01. Если требуется сделать перерасчет в связи с заменой лет по заявлению, сотрудник должен создать заявку в Личном кабинете по теме ""Больничный"", ""Перерасчет пособий"".",БиР
41,41,"Не устраивает выплата по беременности и родам, как произведен расчет?","С данным вопросом сотруднику необходимо обратиться в СФР по номеру телефона 8 (800) 100-00-01. Если требуется сделать перерасчет в связи с заменой лет по заявлению, сотрудник должен создать заявку в Личном кабинете по теме ""Больничный"", ""Перерасчет пособий"".",БиР
42,42,"Что делать, если пособие по рождению ребенка оформлено, но не поступило?","С данным вопросом сотруднику необходимо обратиться в СФР по номеру телефона 8 (800) 100-00-01. Если требуется сделать перерасчет в связи с заменой лет по заявлению, сотрудник должен создать заявку в Личном кабинете по теме ""Больничный"", ""Перерасчет пособий"".",БиР
43,43,"перевестись, находясь в декрете",Перевод возможен после окончания отпуска по беременности и родам.,БиР
44,44,перевестись во время отпуска БИР,Перевод возможен после окончания отпуска по беременности и родам.,БиР
45,45,можно ли перевестись в период отпуска по БиР?,Перевод возможен после окончания отпуска по беременности и родам.,БиР
46,46,я могу перевести во время отпуска по беременности?,Перевод возможен после окончания отпуска по беременности и родам.,БиР
